{
  "schema_version": "1.0.0",
  "research_id": "home-research-001",
  "research_request": "收集虚构家居内容账号受众对玄关整理的常见问题和表达。",
  "audience": {"description": "居住空间有限、希望保持入口整洁的人", "needs": ["方便取放", "不挡通行"]},
  "content_domain": "合成家居整理示例",
  "research_goal": "提供可供选题规划参考的候选问题和关键词表达",
  "seed_keywords": ["玄关整理", "小空间收纳"],
  "profile_ref": "synthetic-home-profile",
  "data_sources": ["local_json"],
  "synthetic": true
}
